Document	psif
of Induction furnaces disassembly operations.	nonsif
There was cement broken in the tagging area.	nonsif
A person could have slipped and leg go under the kick plate.	nonsif
Employees were removing compoent parts from a transformer in the transformer area disassembly operations.	nonsif
Switching Request System SRS Notification.	nonsif
Dept Team Super Mardi Manahar.	nonsif
JOb team leader.	nonsif
Job absentee x yrs working on leader job x week.	nonsif
Correct Plaque Placement During a walk down at TSS West.	nonsif
Overall the yard was clean and organized.	nonsif
PAs spend most of their time at this operation.	nonsif
Good Catch Andegt Cut for safety No face plate.	nonsif
There were no injuries sustained in this incident.	nonsif
My fingers are hurting so bad.	nonsif
Started having pain and swelling in my left thumb after continuously pushing pins.	nonsif
I m experiencing pain now even when I m not working.	nonsif
Material handler then got to his feet and into the vehicle.	nonsif
Supervisor and employee then went to OHS to be evaluated.	nonsif
OHS then advised to be checked by the local PIC clinic.	nonsif
pulling yard materia.	nonsif
The second material handler immediately call his supervisor to report.	nonsif
Supervisor asked the material handler questions regarding his well being and condition.	nonsif
security found unlocked door during night security inspection.	nonsif
At about AM the top poly needed to bechanged.	nonsif
The double sided tape didntstick all the way across the poly roll.	nonsif
It stuck to one of the rolls in the PePac and became stuck.	nonsif
They ended up cutting the poly get it unstuck.	nonsif
They then rethreaded the poly.	nonsif
The surge tank agitator base came loose sheared bolts.	nonsif
This caused the grating around it to become dislodged making unsafe walking surfaces.	nonsif
This is accessible only with a key.	nonsif
I was filing and felt something go into my eye.	nonsif
Good catch CR by TG South engineers.	nonsif
I grabbed a cable to unhook it from the die.	nonsif
Picking a part and banged my elbow on rack while pulling part out.	nonsif
Exact location B B.	nonsif
ICC Complaint on SR Partial power On Wednesday.	nonsif
On April th a Change Meter Only service ticket was issued.	nonsif
traveling to site vehicle operations.	nonsif
While working on the preconditioner and high pressure stand developed right shoulder arm pain.	nonsif
S EE enters medical with c o pain to R Wrist.	nonsif
Because of this nuisance alarm printing the staff had disabled the print function.	nonsif
Lines need to be painted in the MOD area.	nonsif
Employee states that he was lifting a leading bar into the press.	nonsif
Body Part Right SHLDR.	nonsif
Is there an issue with the hot water on the second floor.	nonsif
when he swung his hammer he struck the tip of his left middle finger.	nonsif
The employee asked to be seen by a doctor.	nonsif
Employee was wearing gloves at the time of injury.	nonsif
Went to the Nurse for ice pack.	nonsif
Went up on scaffolding and checked gate and kick plates elevated work operations.	nonsif
FLS failed to have a questioning attitude.	nonsif
FLS order the new fuse.	nonsif
he was operating the preform machines in compression department and developed a rash.	nonsif
Observed employee cleaning up.	nonsif
was moving a hinge detail cart and twisted my wrist.	nonsif
Risk Mitigation Equipment operation rear lot work energized single phz behind fuse.	nonsif
Starter donned kv gloves and guided pole into hole.	nonsif
Crew tamped pole using proper body mechanics and cleaned up the spoils.	nonsif
Support structure for an abandoned reuse water line failed causing approx.	nonsif
foot of PE pipe to fall partially to the ground.	nonsif
IE prior to being racked back into cubicles and put into service.	nonsif
He came downstair taking a external service stairway set on the wall.	nonsif
Employee was assisting the wet chop packout operator doff a box of wet chop.	nonsif
The floors of ALL PEECCs had grit and dirt.	nonsif
The areas were cleaned.	nonsif
The employee was in close proximity to the terminal blocks.	nonsif
AMI Abase Install.	nonsif
Minor injury while miss handling the component.	nonsif
Follow SOP before performing the operation use proper PPEs.	nonsif
EE was catching a drying acid sample out of sample box.	nonsif
When sample bottle overfilled EE tried to back away quickly and tripped and fell.	nonsif
EE said he was not hurt.	nonsif
The electrical panel by door was blocked with a cart and some bin lids.	nonsif
Cart blocking center walk way.	nonsif
During a cleaning task.	nonsif
Fortunately Ee sustained no injury no cuts or bruises.	nonsif
employee was handling material when he received a laceration to his forearm.	nonsif
Roll on machine.	nonsif
Employee was removing a paper holder that was somewhat difficult to remove.	nonsif
He pulled on it and it released and hit him in the forehead.	nonsif
Unpacking components and de canting to WIP carts.	nonsif
States he also must torque down an antenna which is added element to job.	nonsif
file cabinet Walking in FMO office area.	nonsif
Turned corner too sharp and walked into file cabinet.	nonsif
Bumped forehead on top corner of file cabinet.	nonsif
File cabinet drawers were closed.	nonsif
While walking through AP EE struck the lower section of a in.	nonsif
Mondi pipe hanger with his hard hat.	nonsif
EE felt soreness in his neck and reported the incident to his Supervisor.	nonsif
Employee went to get ear plugs from graphite station on PPE locker.	nonsif
He dropped some on the ground and bent over to pick them up.	nonsif
During welding works employees used correct tools and equipment.	nonsif
Positive observation Positive observation.	nonsif
Was throwing material on rack felt Lft.	nonsif
Coming from creel room to winder room feels pulling door may have injured shoulder.	nonsif
Notice s most when lifting Kgs packages to load creel.	nonsif
Line was running R Kraft rolls to autounitizers.	nonsif
Two rolls became jammed up on the conveyors and rolls build up behind them.	nonsif
Propellant escaped can.	nonsif
we could save energy and water through using only one washing procedure instead two.	nonsif
The quality of rolls is very good.	nonsif
See energy tracking for.	nonsif
EE reports pain in right trap area and low mid low back.	nonsif
gave tool box talk on the importance on daily hand tool inspections.	nonsif
ee bruised thumb.	nonsif
EE was lifting a x ray tube out of the box.	nonsif
Need a JSA on repackaging X ray tubes for service.	nonsif
Area supervisor will ensure proper packaging material is provided.	nonsif
When doing this employee felt sharp pain in mid and upper back area.	nonsif
I got a sliver in my finger.	nonsif
I put gloves on to Error Proof stations.	nonsif
I got a sliver when I was loading parts.	nonsif
I put the gloves on to lift steel parts to put in the station.	nonsif
Subject of discussion.	nonsif
Operating forklift WO completing safety check list woodworking.	nonsif
CO right elbow and back pain.	nonsif
Employees carrying bucket many times can result in back injury.	nonsif
Gabriel was working in the granule area and production wad unloading headlap granules.	nonsif
He thinks he rubbed his eye and introduced the dust in to it.	nonsif
Rph compounded MAG kit.	nonsif
office all safety equipment is in place.	nonsif
I got something in my left middle finger.	nonsif
Files removed from on top of cupboard in area.	nonsif
ASSOC FOUND LYING ON GROUND NEAR SULFUR UNLOADING STATION HEAD INJURY.	nonsif
En marchant sur la ligne lemploy a ressenti une douleur dans le pied gauche.	nonsif
While running operations realized the dryer cyclone was plugged.	nonsif
At the plant was shut down to clean the cyclone.	nonsif
EE was working on Building Section A cleaning up stacking K shoring scaffold.	nonsif
EE lifted the shoring scaffold and placed on the shoulder for transport.	nonsif
EE was wearing eye protection during the incident.	nonsif
EE reported the incident to the Job Superintendent at PM.	nonsif
Superintendent flushed EEs eye and could not locate any foreign body.	nonsif
EE went back to work and did not complain of any discomfort.	nonsif
FLS specificity reminded crew leader to close task midday.	nonsif
Moving rollers into position with crane to adjust to Box.	nonsif
Went to move wall out with wheel handle while holding the roller.	nonsif
Did nt feel anything pop or stretch.	nonsif
Noticed sore elbow minutes later.	nonsif
Duplicate Meter Number.	nonsif
A Skokie ET completed CMOs on Friday January th.	nonsif
One was located Greenwood St in Skokie and the other was at N Northwest.	nonsif
Hwy Unit in Park Ridge.	nonsif
the operator had thorn on the hand.	nonsif
Employee was assiting another employee for surveying at consteel.	nonsif
While walking below the consteel employee tripped on tie rod lying on floor.	nonsif
Guide bars at Automat are leaning unsecured when not in use.	nonsif
EWR raised to have emergency lighting installed into maintenance corridor of M range.	nonsif
Assigned ATS to Ergonomic and PPE to followup with employee.	nonsif
yard debris tripping hazard tug crew is installing new pot heads at tss.	nonsif
we contacted nash and more gravel was brought in to make walking area smooth.	nonsif
General Alert to field team review of JSA Training to determine if changes needed.	nonsif
Employee came to the clinic with complaints of left shoulder and upper back pain.	nonsif
Referred to ergo team for further evaluation of workstation Purchase optical trackball and keybooard.	nonsif
I just doing the job.	nonsif
And pushing in two push pins.	nonsif
The nd push pin is broken so it takes extreme force to push in.	nonsif
rack door fell off and hit right foot.	nonsif
Live Dead Live not used and oil sample not taken.	nonsif
He used two punches one for the ID and one for the OD.	nonsif
Gloves were worn at all times.	nonsif
After placing the gasket the crew tightened down the site glass.	nonsif
They then refilled the oil to its proper level.	nonsif
He stated that he was sure his A Mechanic did.	nonsif
The FLS then questioned the A Mechanic who stated that he did not.	nonsif
The crew remediated this with the A Mech and the B Mech.	nonsif
The SSC crew split into two groups.	nonsif
The crew also used good three way communication while working on the breakers.	nonsif
Employee was cleaning in the highbay sweeping up debris and throwing away.	nonsif
Cut my knee of floor mat secure.	nonsif
The job requires me to check the primary and secondary lock function.	nonsif
I have a sharp pain causalgia at the base of my left wrist.	nonsif
I need a wrist rest cushion for wrist support.	nonsif
Doing this same job over and over with out rotation.	nonsif
Employee misjudged step into scrubber and tripped.	nonsif
Desk chair pan flattened out and caused tail bone pain.	nonsif
Replaced the chair and adjused the workstation.	nonsif
Good Catch Highway Debris.	nonsif
To do so he must pass through a narrow passage.	nonsif
Tech s vehicle lights were functional windows clean and seat belt in good condition.	nonsif
When reviewing the monthly vehicle inspection checklist.	nonsif
tech did not sign the form.	nonsif
Tech agreed and signed the form.	nonsif
Good Catch during review of CIMS Billing Adj.	nonsif
Both of these individuals were out of the office at this time.	nonsif
The ComEd CIMS.	nonsif
Both the CIMS Administrator and Director assumed all of the verification steps were completed.	nonsif
The person preparing the file does not perform this review for an independent perspective.	nonsif
This file validation was overlooked during this particular month.	nonsif
Employee was unloading ammo cans from his vehicle.	nonsif
EE has been consulted on the importance of reporting any and all events immediately.	nonsif
They noticed the redness on Saturday.	nonsif
Contusion to Rt Baby finger.	nonsif
Job title Security Guard x yrs.	nonsif
Was on second floor at about D at vending machine in satellite canteen.	nonsif
Cutting grass On network high rise group had an ermergent job at CTLX.	nonsif
While the crew was working on replacement of the line bay switch gear.	nonsif
The customers lawn service crew started to cut or maintenance the grass.	nonsif
And showed him the cables on the grass and transformer area.	nonsif
Worker did see the crew working or generator stage there.	nonsif
Rockford Reader found Open fitting.	nonsif
EE carried buckets without using any gloves material handling.	nonsif
LC stairwell door ajar second occurence.	nonsif
The south stairwell door in LC was left ajar by the previous user.	nonsif
Scaffold was installed without intsalling handrails causing a fall hazard closed.	nonsif
onset of Rt forearm pain today approx.	nonsif
She tripped a little but was able to recover without falling or getting hurt.	nonsif
Area de empilhamento de rotor ha excesso de pinos de rotor no local.	nonsif
Bonadio Retirar da area os pinos obsoletos e devolver ao almoxarifado.	nonsif
A cover plate in the hallway extending to Pharmacy labortory came loose.	nonsif
frequent outages AB.	nonsif
I was bending over in the coffin lifting the parts out.	nonsif
the parts are kind of heavy.	nonsif
I put one part in location then I put a second one.	nonsif
I felt my lower back tighten up.	nonsif
Employee had Facial protection goggles gowning and gloves.	nonsif
Negligible damage to both pieces of equipment.	nonsif
Walk around avoided glass.	nonsif
I got in my car and exited the parking area per plan.	nonsif
I exited the car and walked to the work area.	nonsif
Before going to the drivers door.	nonsif
The pothole was filled with broken glass.	nonsif
Crew Permit Times.	nonsif
To service and inspect deluge system in pumphouse.	nonsif
Tape Residue Found on Meter.	nonsif
Black Ice Condition in substation On Crews Job site reporting to TSS.	nonsif
The walking and driving surface were getting worst as the day progress.	nonsif
This was a good questioning attitude on risk assessment at the job site.	nonsif
PMP needs lights on take up.	nonsif
Edge of box Employee was lowering a box to the floor.	nonsif
A plan was devised and clearance orders were created to perform the work.	nonsif
The Station SDSD reviewed these routines and identified an issue.	nonsif
These stops included the Field Museum and Shedd Aquarium.	nonsif
These SDSD stopped to investigate.	nonsif
Portable ladder had a rag wrapped around one of the feet.	nonsif
The exhaust is piped through the celing of building.	nonsif
The standing oil could have been caused someone to slip.	nonsif
Work related lost work day case.	nonsif
See injury illness report for details.	nonsif
pliers employee was using pliers to loosen a bolt in a box.	nonsif
Employee was hand doffing positions because position was being worked on.	nonsif
Employee had only been hand doffing for min.	nonsif
Relates to bending pushing and pulling carts full of parts.	nonsif
Structure Identified on WO to be C Trussed was Incorrect.	nonsif
TR had obvious damage and STR did not have any damage.	nonsif
STR had the rejection tag on from the Osmose inspection.	nonsif
Expired diphen tablet.	nonsif
THERE IS NO WAY TO STOP BUILD UP OF MATT.	nonsif
WITHOUT TAKING THE TIME TO STEAM CLEAN FLOOR EVEY NOW AND THEN.	nonsif
determine location of concern and a plan of action.	nonsif
S EE enters medical with c o pain to R Elbow.	nonsif
EE states Every time I go to bolt down the wipers.	nonsif
Amped I and ComEd LRE PM completed a job brief including safety assessment.	nonsif
PPE was peer checked by team members.	nonsif
Vault conditions were assessed and discussed prior to entry.	nonsif
Flash lights were assigned due to limited working light bulbs.	nonsif
Associate bending and squatting down when felt and heard a pop from right knee.	nonsif
liftgate install one month.	nonsif
Mechanic was wearing all of his PPE when the sand blew in his eye.	nonsif
Operator was keeping the tools and hard mask in the ground housekeeping.	nonsif
Outside vendors are making deliveries wearing sandals.	nonsif
The vendor is inside the building during delivery.	nonsif
The screw of the fire extinguisher holder at front entrance came off the wall.	nonsif
Employee was unloading rolls of wool from the finished goods conveyor aprx lbs.	nonsif
Employee was taken to medical for first aid and released back to work.	nonsif
Some coworkers helped him into a work truck to cool down.	nonsif
Employee returned to work.	nonsif
Barricade was removed.	nonsif
Employee was pulling coating equipment to top of scaffold with rope and valve failed.	nonsif
While moving systems a Shred it bin fell.	nonsif
EE kept a heating pad on it all weekend.	nonsif
Post information on proper lifting for employees to read.	nonsif
DI trailer in alarm due to high mixbed effulent conductivity.	nonsif
This table is how SCADA and OMS associate the common points between them.	nonsif
Mold observed on several ceiling tiles in the work area of Government Nets.	nonsif
MALAYSIA Ask Campus Eng.	nonsif
To send the driver for safety induction.	nonsif
Ask Campus Eng.	nonsif
He blew the locamotive horm and proceeded.	nonsif
Now rolls the amp wires from front to back.	nonsif
Pushing in clips is also aggravating condition.	nonsif
drums with steamate na packaging.	nonsif
While purging oil the syringe broke glass pieces cut his finger Investigation rootcause.	nonsif
This makes operator to force it causing the syringe to break.	nonsif
Next possibility of to change the syringe on a daily basis.	nonsif
S EE enters medical with c o pain to Right Wrist Hand Finger.	nonsif
STA Powerton ATS Damage Issue STA Powerton generator trouble alarm.	nonsif
sending degree water raining down on the area below.	nonsif
While onsite the construction manager highlighted the following deficiencies.	nonsif
Improper Location of Job Brief.	nonsif
Lack of Crew Knowledge Awareness.	nonsif
The construction manager observed crews working at separate manhole locations approximately feet apart.	nonsif
This equipment was removed by the entrant moments before exiting the manhole.	nonsif
The ComEd auditor addressed with the crew supervisor.	nonsif
He forgot to lock the door when he departed the cab of the truck.	nonsif
Warehousing operation in Singapore vehicle operations.	nonsif
Found air hose ran across deck TEXAS Pulled it up ran over head.	nonsif
Pulled it up ran over head.	nonsif
This created a safety hazard to passersby and the equipment needed repairs.	nonsif
Employee was working on the TTSS.	nonsif
Employee locked out the TTSS to do the repairs.	nonsif
After removing the lock the TTSS became stuck in the down position.	nonsif
The employee applied hot water to attempt to free the TTSS.	nonsif
Pick boxes of lock kits from high and low areas hundreds per ticker.	nonsif
Pick a book of lock kits for L.	nonsif
Every Book Ticket at boxes per ticket.	nonsif
Some locations up some down and under.	nonsif
This incident is being upgraded to an RWD.	nonsif
During the washing after chrome plating all employee are asked to wear face shield.	nonsif
Vinscx GLB Cut bypass handle.	nonsif
The tech was able to give a good job briefing.	nonsif
The tech was on an aged order for a connect.	nonsif
As he rotated the wheel it released quicker than anticipated.	nonsif
The interlock was engaged and no injury sustained.	nonsif
Old heat exhaust duck pipe behind the chemical wash tank.	nonsif
The contractors was needing to rinse off Cathode Probes with water.	nonsif
The fluid was determined to be residual acid in the hose.	nonsif
Contractor was inside the reactor in A Phos Acid Plant building scaffolding.	nonsif
Discarded brick laying on floor.	nonsif
Station Warmer lineSpindle that holds the back of chair has fallen out.	nonsif
Housekeeping violations in the office.	nonsif
saw chips all over the floor in the red isle.	nonsif
points contact FTE was standing on tire of truck to clear snow from windshield.	nonsif
The hotel had stored my luggage for the day while working.	nonsif
With the three bags walked one block to the Lyft location.	nonsif
IP strained back whilst moving pallets of nylon resin.	nonsif
No accident happen.	nonsif
While reviewing the tech s vehicle supervisor noted that there were only cones.	nonsif
The expectation is that the techs carry cones.	nonsif
In this case replacement of the missing cones.	nonsif
Additionally the transformer was half buried.	nonsif
The locator stopped his work photographed the scene and notified his supervisor.	nonsif
The supervisor met him part of the way down and assisted him.	nonsif
It was also verified that the previous flooding issue had been resolved.	nonsif
LCS Planning Department and the job owner were engaged.	nonsif
The old building vault was being cutoff for future demolition.	nonsif
Concern over the ergonomics with respect to the shelving unit at roving inspection.	nonsif
ergonomic assessment Ergo assessment completed by Jon Lee and sent to EHS Specialist.	nonsif
Observed very good ZOP filled out.	nonsif
Proper testing methods filled out when applicable.	nonsif
PPE good Mitigation tools used Environmental used.	nonsif
The operator banged the head against a cone of candle Twintex.	nonsif
Heaters and light not working on North wall.	nonsif
The heaters have power but fail to turn on.	nonsif
Also the wall outlets and lights bulbs are not working.	nonsif
Battery temperature is below optimal due to loss of heaters.	nonsif
The EE reported the injury immediately to the site superintendent.	nonsif
WCV was contacted to assist in the injury management process.	nonsif
Maywood MR Open Fitting.	nonsif
lifting more than stopped and got help stopped and got help.	nonsif
In the foundry area at machine there is a gas hose damaged.	nonsif
Held safety talk July.	nonsif
Also landed on left knee.	nonsif
Right side of back hurts now too.	nonsif
Walking across line leg was scrapped by skut.	nonsif
pit system started up at am pit was bringing up lift pumps slow hyd.	nonsif
Called out maintenance mechanics to replace broken belts on the coarse cond.	nonsif
The mechanic lifted the belt guard high enough to replace the belts.	nonsif
While changing the belts the eyelet on top of the guard broke.	nonsif
The guard fell and landed on employee s right hand.	nonsif
Alerted supervisor who said he d resolve the issue.	nonsif
Went to push front pin in place and my knee felt like it popped.	nonsif
Possible Unsafe condition verified.	nonsif
This is Nick Koliopoulos reporting out on an event that occurred at CS barn.	nonsif
The wire was about off of the slab.	nonsif
EE states that she works in dept Team Job Sta B.	nonsif
She felt something bite her on her left forearm and noticed swelling and redness.	nonsif
She did not actually see an insect.	nonsif
d s helping in shipping shipping receiving.	nonsif
Manually loading plastic bins onto van.	nonsif
Went to cut strand that was still attached to the collet.	nonsif
from shift leader report.	nonsif
Contusion Left MIddle Finger.	nonsif
A wind came up and the gate swung and struck the mower.	nonsif
The gate section was damaged and will need replacing.	nonsif
The crew spliced assuming that the cable was trained and racked for HYPK.	nonsif
The crew completed work and demobilized from the site.	nonsif
The top side of open SW was energized with kV.	nonsif
The arrestor has been removed for autopsy by ComEd Engineering.	nonsif
The Z cable went to SW at a cable terminal pole for kV circuit.	nonsif
The splicing crew failed to verify circuit and phase ID kV circuit HYPK.	nonsif
empty wheel resting on rims with no chocks high bay.	nonsif
Failed to announce presence loudly.	nonsif
Job jitney driver x yrs but is working on inventory counting.	nonsif
EE was counting aluminum patches with rt hand and hit the edge.	nonsif
Roadway lighting circuit from loading rack to front parking lot not working.	nonsif
Replaced faulty photo electric switch.	nonsif
Inspection of ladders ladder operations.	nonsif
Dept Job kill cell operator Supervisor L Powell.	nonsif
A bandaid was put on the scratch.	nonsif
No other medical attention is anticipated.	nonsif
Eyes not on work.	nonsif
Changing lug welder nozzle and nozzle bur nt L thumb.	nonsif
Heading north on TX HWY.	nonsif
There was a community college on right.	nonsif
The person appeared to be turning left.	nonsif
Our employee t boned the vehicle at about mph.	nonsif
EHS Leader Tom Tuebo and employee discussed the Smith System Keys.	nonsif
Employee could not have prevented accident.	nonsif
Witness David Richie.	nonsif
No corrective actions will be assigned.	nonsif
Late submittal of timecard Timesheet was submitted with work order tasks missing.	nonsif
Employee went to maint shop to check cage for drive belts.	nonsif
I DID N T BLACK OUT.	nonsif
BUT MY HEAD IS REALLY HURTING.	nonsif
Incorrect Job Scope.	nonsif
Crew dispatched to replace arrestors on a transformer Rush University.	nonsif
Several of our staff do not have a proper locker room.	nonsif
That gives them splinters in their feet.	nonsif
Issue reported to TVO for action.	nonsif
Corrective actions performed.	nonsif
Damage occurred while recovering unit from site of sinking.	nonsif
Employee was climbing the stairs on the south east side of the float plant.	nonsif
Reader walked away from an idling vehicle.	nonsif
The interior was in clean condition.	nonsif
Once done scraping the windows the reader walked inside of the building.	nonsif
Crew did not realize that her face in line of fire.	nonsif
Stop the crew and ask he to change he position.	nonsif
maintenance on equipment trying to remove a stuck drip tray under the machine.	nonsif
Employee was working as the machine operator on DM.	nonsif
There was a jamup on DM machine.	nonsif
The employee strained his knee when he stepped off the conveyor cross over.	nonsif
Employee states on DOI.	nonsif
ob RT cradle load x yrs.	nonsif
Ergo relief job.	nonsif
While loading the cradle onto the platform with both hands the hoist got jammed.	nonsif
One of the clamps did not let go.	nonsif
The dust in the bin got in my left eye.	nonsif
TDC Oldest DSOC in South Region.	nonsif
